{
  "$schema": "./galois_english_pdf_visual_inspection.schema.json",
  "schema_version": 1,
  "inspection_kind": "actual-rendered-page-model-visual-inspection",
  "inspection_status": "PENDING",
  "pdf": "",
  "pdf_sha256": "",
  "page_count": 0,
  "render_report": "",
  "render_report_sha256": "",
  "reviewer": {
    "model_id": "",
    "session_or_task_id": "",
    "completed_at_utc": null
  },
  "coverage": {
    "reviewed_pages": [],
    "full_resolution_pages_reviewed": [],
    "contact_sheets_reviewed": []
  },
  "criteria": [
    {
      "id": "clipping-and-cropped-content",
      "status": "PENDING",
      "notes": ""
    },
    {
      "id": "overlap-and-collisions",
      "status": "PENDING",
      "notes": ""
    },
    {
      "id": "broken-or-missing-glyphs",
      "status": "PENDING",
      "notes": ""
    },
    {
      "id": "mathematical-legibility",
      "status": "PENDING",
      "notes": ""
    },
    {
      "id": "image-rule-and-seam-defects",
      "status": "PENDING",
      "notes": ""
    },
    {
      "id": "unexpected-blank-or-black-pages",
      "status": "PENDING",
      "notes": ""
    },
    {
      "id": "typography-spacing-and-hierarchy",
      "status": "PENDING",
      "notes": ""
    },
    {
      "id": "headers-footers-and-page-numbering",
      "status": "PENDING",
      "notes": ""
    }
  ],
  "page_findings": [],
  "overall_result": "PENDING",
  "attestation": ""
}
